Tiker,Date,Title
AMZN,May-19-21,"Amazon Sued by Five Women Alleging Bias, Retaliation"
AMZN,May-19-21,One Company To Watch As Electric Vehicle Stocks Get Ready To Fly This Summer
AMZN,May-19-21,"Amazon.com faces five new racial, gender bias lawsuits"
AMZN,May-19-21,"UPDATE 1-Echoing Amazon: Walmart, Target try local package delivery"
AMZN,May-19-21,"The streaming space is evolving so quickly, mirroring the evolution of traditional TV: ViacomCBS Streaming President & CEO"
AMZN,May-19-21,Is Amazon hugely undervalued?
AMZN,May-19-21,"Echoing Amazon: Walmart, Target try local package delivery"
AMZN,May-19-21,The revenge of the underpaid
AMZN,May-19-21,Oatly's IPO Could Fetch a $10 Billion Valuation This Week. Here's What Investors Need to Know
AMZN,May-19-21,"'There clearly will be more consolidation' in streaming space as WarnerMedia, Discovery deal pressures platforms: Media executive"
AMZN,May-19-21,Kellogg CEO: We are battling inflation like everybody else is
AMZN,May-19-21,Amazon Aims to Acquire MGM: Would That Hurt CRE?
AMZN,May-19-21,How to get an Amazon Echo Dot for 99 cents
AMZN,May-19-21,Amazon Halts Police's Use Of Facial Recognition Software: Reuters
AMZN,May-19-21,Is Amazon.com (AMZN) A Great Investment Choice?
AMZN,May-19-21,Is Shopify Stock A Buy After Blowout Earnings Report?
AMZN,May-19-21,"Ampere Says Microsoft, Tencent Are Customers, Unveils New Design"
AMZN,May-19-21,"8 thoughtful gifts for high school grads, all under $25"
AMZN,May-19-21,Are the FAANG Stocks Still Good Buys Today?
AMZN,May-19-21,Movie theater experience has to reinvent itself: Jane Rosenthal
AMZN,May-19-21,Better Buy: Amazon vs. Ulta Beauty
AMZN,May-19-21,Amazon Could Acquire MGM Studios For $9B  Report
AMZN,May-19-21,"Down 25% From Its IPO, Is Now the Time to Buy Coupang?"
AMZN,May-19-21,"Attention, Growth Stock Investors: Price Matters"
AMZN,May-19-21,"Down 40%, Is Now the Time to Buy Spotify Stock?"
AMZN,May-19-21,"From Amazon to McDonald's, here's who's hiking wages amid the labor crunch"
AMZN,May-19-21,Amazon is a cheap stock for long-term investors. These numbers tell you why.
AMZN,May-19-21,Spring Market Mania: These 2 Growth Stocks Are on Sale
AMZN,May-19-21,"4 Unstoppable Stocks With 34% to 51% Upside, According to Wall Street"
AMZN,May-18-21,AWS Announces General Availability of AWS App Runner
AMZN,May-18-21,German Federal Cartel Office Launches Fresh Antitrust Investigation Against Amazon: Report
AMZN,May-18-21,Amazons Talks With MGM Bring Fresh Shine to Old Movie Libraries
AMZN,May-18-21,"'When were really out of the pandemic, youre not going to see... hybrid releases,': IMAX CEO"
AMZN,May-18-21,UPDATE 3-Amazon extends moratorium on police use of facial recognition software
AMZN,May-18-21,Amazon's Bid For MGM Escalates Major Battle To Dominate Movie Market
AMZN,May-18-21,Walmart Earnings Beat As Comp Sales Smash Forecasts
AMZN,May-18-21,Amazon Extends Pause on Police Use of Facial Recognition Tech
AMZN,May-18-21,Shopify Merchants Will Be Showcased on Googles Shopping Site
AMZN,May-18-21,Pro-tax millionaires protest outside Jeff Bezos home on Tax Day
AMZN,May-18-21,Discovery stock could be worth 35% more after AT&T deal: analyst
AMZN,May-18-21,Fears ITV will lose James Bond in $9bn Amazon swoop on MGM
AMZN,May-18-21,Why AT&T's stock is getting smashed after mega media deal with Discovery
AMZN,May-18-21,Amazon Considers Buying Movie Studio MGM for $9 Billion
AMZN,May-18-21,Redbox CEO on building a 'one-stop-shop for entertainment'
AMZN,May-18-21,"3 Tech Stocks That Turned $10,000 Into Over $200,000"
AMZN,May-18-21,Amazon (AMZN) to Broaden Reach in India Via MiniTV Launch
AMZN,May-18-21,Amazon shakes and stirs the streaming wars with MGM deal
AMZN,May-18-21,"Apple (AAPL) Music to Add Lossless Audio, Dolby Atmos Support"
AMZN,May-18-21,Amazon Prime Day 2021: When can you expect it? Is it worth the hype?
AMZN,May-18-21,10 Best Blockchain Stocks to Buy
AMZN,May-18-21,Amazon in talks to buy MGM for $9 billion: RPTS
AMZN,May-18-21,The Latest Sign Amazon Doesn't See Growth Slowing in 2021
AMZN,May-18-21,Amazon Music HD Made Available to All Subscribers at No Extra Cost; Street Says Buy
AMZN,May-18-21,Discovery-WarnerMedia Merger to Rev Up Streaming Competition
AMZN,May-18-21,"Is Amazon Stock A Buy Right Now? Here's What Earnings, Charts Show"
AMZN,May-18-21,1 Top Stock Under $5
AMZN,May-18-21,Which Electric Vehicle Stocks Could Produce 10X Returns?
AMZN,May-18-21,Amazon in Talks to Buy MGM
AMZN,May-18-21,3 No-Brainer Buys When the Market Crashes
AMZN,May-18-21,Your Stock Market Crash Checklist: 10 Things to Do
AMZN,May-18-21,Dogecoin Is All Hype: Buy These Surefire Stocks Instead
AMZN,May-18-21,Walmart Has Lost Its Lead in Online Grocery
AMZN,May-18-21,Amazon in talks to buy James Bond studio MGM for $9bn
AMZN,May-18-21,"Walmart, Amazon, Home Depot, Fisker, Wells Fargo - 5 Things You Must Know"
AMZN,May-18-21,"Amazon in Talks to Buy Film Studio MGM, Reports Say"
AMZN,May-17-21,Amazon in talks to buy James Bond studio MGM
AMZN,May-17-21,Amazon's Twitch Lowering Non-U.S. Subscription Prices
AMZN,May-17-21,Amazon in talks to buy MGM for $9bn
AMZN,May-17-21,Amazon Said to Make $9 Billion Offer for MGM
AMZN,May-17-21,"Amazon Could Skyrocket 83% by 2023, Analyst Says"
AMZN,May-17-21,This Transportation Stock Has Outperformed Big Tech Over the Past Decade
AMZN,May-17-21,What the WarnerMedia-Discovery mergers means for the streaming wars
AMZN,May-17-21,Amazon Mailbox Modification Is Latest Twist in Union Election
AMZN,May-17-21,Market volatility to continue through the summer: People's United Advisors CIO
AMZN,May-17-21,Amazon-Backed Tado Raises $46M In Fundraiser Before IPO: FT
AMZN,May-17-21,AT&T admits it made a terrible mistake getting into media business with Discovery deal: analyst
AMZN,May-17-21,Inflation has been the friend of stocks: Strategist
AMZN,May-17-21,"Discovery with AT&T's media assets will put pressure on Netflix, others: analyst"
AMZN,May-17-21,U.S. experiencing 'a marked shift in bargaining power towards lower-income workers'
AMZN,May-17-21,"Apple and Amazon Boost Sound Quality of Streaming Music, Targeting Spotify"
AMZN,May-17-21,"Amazon, Apple not to charge extra for lossless music"
AMZN,May-17-21,The 3 Smartest Stocks to Buy in a Reopening Economy
AMZN,May-17-21,"Why the AT&T, Discovery deal puts the most pressure on Comcast"
AMZN,May-17-21,Where Will Walmart Be in 5 Years?
AMZN,May-17-21,10 Small-Cap Stocks With Huge Growth Potential
AMZN,May-17-21,"7 best free and paid-for VPNs for streaming and security on your Android, iPhone, PC and more"
AMZN,May-17-21,3 Reasons Best Buy Stock Will Likely Be Higher in 5 Years
AMZN,May-17-21,Mask mandate: These retailers will now let you shop without a mask
AMZN,May-17-21,"Amazon Music HD For All, Now at No Extra Cost"
AMZN,May-17-21,Better Buy: Amazon vs. Target
AMZN,May-17-21,Amazon Union Vote in Spotlight as Labor Board Resumes Hearing
AMZN,May-17-21,Bitcoin Wont Stop Dropping. Blame Elon Musk.
AMZN,May-17-21,"Inspirational Quotes: Drew Brees, Laura Ingalls Wilder, Dave Clark And Others"
AMZN,May-17-21,"The Zacks Analyst Blog Highlights: Spotify, Apple and Amazon"
AMZN,May-17-21,"The Zacks Analyst Blog Highlights: Amazon, Tesla, NextEra Energy, CME Group and Boston Scientific"
AMZN,May-17-21,"From Body Mechanics to Mindfulness, Amazon Launches Employee-Designed Health and Safety Program called WorkingWell Across U.S. Operations"
AMZN,May-17-21,3 Robinhood Stocks to Buy Right Now That Are Better Than Dogecoin
AMZN,May-17-21,"Lucira Health, Inc. (LHDX) Q1 2021 Earnings Call Transcript"
AMZN,May-17-21,Glaxo Study Has Positive Results; Singapore Curbs: Virus Update
AMZN,May-16-21,Amazon-backed Tado raises $46m in final fundraising round
