Tiker,Date,Title
AMZN,May-19-21,"Amazon Sued by Five Women Alleging Bias, Retaliation"
AMZN,May-19-21,One Company To Watch As Electric Vehicle Stocks Get Ready To Fly This Summer
AMZN,May-19-21,"Amazon.com faces five new racial, gender bias lawsuits"
AMZN,May-19-21,"UPDATE 1-Echoing Amazon: Walmart, Target try local package delivery"
AMZN,May-19-21,"The streaming space is evolving so quickly, mirroring the evolution of traditional TV: ViacomCBS Streaming President & CEO"
AMZN,May-19-21,Is Amazon hugely undervalued?
AMZN,May-19-21,"Echoing Amazon: Walmart, Target try local package delivery"
AMZN,May-19-21,The revenge of the underpaid
AMZN,May-19-21,Oatly's IPO Could Fetch a $10 Billion Valuation This Week. Here's What Investors Need to Know
AMZN,May-19-21,"'There clearly will be more consolidation' in streaming space as WarnerMedia, Discovery deal pressures platforms: Media executive"
AMZN,May-19-21,Kellogg CEO: We are battling inflation like everybody else is
AMZN,May-19-21,Amazon Aims to Acquire MGM: Would That Hurt CRE?
AMZN,May-19-21,How to get an Amazon Echo Dot for 99 cents
AMZN,May-19-21,Amazon Halts Police's Use Of Facial Recognition Software: Reuters
AMZN,May-19-21,Is Amazon.com (AMZN) A Great Investment Choice?
AMZN,May-19-21,Is Shopify Stock A Buy After Blowout Earnings Report?
AMZN,May-19-21,"Ampere Says Microsoft, Tencent Are Customers, Unveils New Design"
AMZN,May-19-21,"8 thoughtful gifts for high school grads, all under $25"
AMZN,May-19-21,Are the FAANG Stocks Still Good Buys Today?
AMZN,May-19-21,Movie theater experience has to reinvent itself: Jane Rosenthal
AMZN,May-19-21,Better Buy: Amazon vs. Ulta Beauty
AMZN,May-19-21,Amazon Could Acquire MGM Studios For $9B  Report
AMZN,May-19-21,"Down 25% From Its IPO, Is Now the Time to Buy Coupang?"
AMZN,May-19-21,"Attention, Growth Stock Investors: Price Matters"
AMZN,May-19-21,"Down 40%, Is Now the Time to Buy Spotify Stock?"
AMZN,May-19-21,"From Amazon to McDonald's, here's who's hiking wages amid the labor crunch"
AMZN,May-19-21,Amazon is a cheap stock for long-term investors. These numbers tell you why.
AMZN,May-19-21,Spring Market Mania: These 2 Growth Stocks Are on Sale
AMZN,May-19-21,"4 Unstoppable Stocks With 34% to 51% Upside, According to Wall Street"
AMZN,May-18-21,AWS Announces General Availability of AWS App Runner
AMZN,May-18-21,German Federal Cartel Office Launches Fresh Antitrust Investigation Against Amazon: Report
AMZN,May-18-21,Amazons Talks With MGM Bring Fresh Shine to Old Movie Libraries
AMZN,May-18-21,"'When were really out of the pandemic, youre not going to see... hybrid releases,': IMAX CEO"
AMZN,May-18-21,UPDATE 3-Amazon extends moratorium on police use of facial recognition software
AMZN,May-18-21,Amazon's Bid For MGM Escalates Major Battle To Dominate Movie Market
AMZN,May-18-21,Walmart Earnings Beat As Comp Sales Smash Forecasts
AMZN,May-18-21,Amazon Extends Pause on Police Use of Facial Recognition Tech
AMZN,May-18-21,Shopify Merchants Will Be Showcased on Googles Shopping Site
AMZN,May-18-21,Pro-tax millionaires protest outside Jeff Bezos home on Tax Day
AMZN,May-18-21,Discovery stock could be worth 35% more after AT&T deal: analyst
AMZN,May-18-21,Fears ITV will lose James Bond in $9bn Amazon swoop on MGM
AMZN,May-18-21,Why AT&T's stock is getting smashed after mega media deal with Discovery
AMZN,May-18-21,Amazon Considers Buying Movie Studio MGM for $9 Billion
AMZN,May-18-21,Redbox CEO on building a 'one-stop-shop for entertainment'
AMZN,May-18-21,"3 Tech Stocks That Turned $10,000 Into Over $200,000"
AMZN,May-18-21,Amazon (AMZN) to Broaden Reach in India Via MiniTV Launch
AMZN,May-18-21,Amazon shakes and stirs the streaming wars with MGM deal
AMZN,May-18-21,"Apple (AAPL) Music to Add Lossless Audio, Dolby Atmos Support"
AMZN,May-18-21,Amazon Prime Day 2021: When can you expect it? Is it worth the hype?
AMZN,May-18-21,10 Best Blockchain Stocks to Buy
AMZN,May-18-21,Amazon in talks to buy MGM for $9 billion: RPTS
AMZN,May-18-21,The Latest Sign Amazon Doesn't See Growth Slowing in 2021
AMZN,May-18-21,Amazon Music HD Made Available to All Subscribers at No Extra Cost; Street Says Buy
AMZN,May-18-21,Discovery-WarnerMedia Merger to Rev Up Streaming Competition
AMZN,May-18-21,"Is Amazon Stock A Buy Right Now? Here's What Earnings, Charts Show"
AMZN,May-18-21,1 Top Stock Under $5
AMZN,May-18-21,Which Electric Vehicle Stocks Could Produce 10X Returns?
AMZN,May-18-21,Amazon in Talks to Buy MGM
AMZN,May-18-21,3 No-Brainer Buys When the Market Crashes
AMZN,May-18-21,Your Stock Market Crash Checklist: 10 Things to Do
AMZN,May-18-21,Dogecoin Is All Hype: Buy These Surefire Stocks Instead
AMZN,May-18-21,Walmart Has Lost Its Lead in Online Grocery
AMZN,May-18-21,Amazon in talks to buy James Bond studio MGM for $9bn
AMZN,May-18-21,"Walmart, Amazon, Home Depot, Fisker, Wells Fargo - 5 Things You Must Know"
AMZN,May-18-21,"Amazon in Talks to Buy Film Studio MGM, Reports Say"
AMZN,May-17-21,Amazon in talks to buy James Bond studio MGM
AMZN,May-17-21,Amazon's Twitch Lowering Non-U.S. Subscription Prices
AMZN,May-17-21,Amazon in talks to buy MGM for $9bn
AMZN,May-17-21,Amazon Said to Make $9 Billion Offer for MGM
AMZN,May-17-21,"Amazon Could Skyrocket 83% by 2023, Analyst Says"
AMZN,May-17-21,This Transportation Stock Has Outperformed Big Tech Over the Past Decade
AMZN,May-17-21,What the WarnerMedia-Discovery mergers means for the streaming wars
AMZN,May-17-21,Amazon Mailbox Modification Is Latest Twist in Union Election
AMZN,May-17-21,Market volatility to continue through the summer: People's United Advisors CIO
AMZN,May-17-21,Amazon-Backed Tado Raises $46M In Fundraiser Before IPO: FT
AMZN,May-17-21,AT&T admits it made a terrible mistake getting into media business with Discovery deal: analyst
AMZN,May-17-21,Inflation has been the friend of stocks: Strategist
AMZN,May-17-21,"Discovery with AT&T's media assets will put pressure on Netflix, others: analyst"
AMZN,May-17-21,U.S. experiencing 'a marked shift in bargaining power towards lower-income workers'
AMZN,May-17-21,"Apple and Amazon Boost Sound Quality of Streaming Music, Targeting Spotify"
AMZN,May-17-21,"Amazon, Apple not to charge extra for lossless music"
AMZN,May-17-21,The 3 Smartest Stocks to Buy in a Reopening Economy
AMZN,May-17-21,"Why the AT&T, Discovery deal puts the most pressure on Comcast"
AMZN,May-17-21,Where Will Walmart Be in 5 Years?
AMZN,May-17-21,10 Small-Cap Stocks With Huge Growth Potential
AMZN,May-17-21,"7 best free and paid-for VPNs for streaming and security on your Android, iPhone, PC and more"
AMZN,May-17-21,3 Reasons Best Buy Stock Will Likely Be Higher in 5 Years
AMZN,May-17-21,Mask mandate: These retailers will now let you shop without a mask
AMZN,May-17-21,"Amazon Music HD For All, Now at No Extra Cost"
AMZN,May-17-21,Better Buy: Amazon vs. Target
AMZN,May-17-21,Amazon Union Vote in Spotlight as Labor Board Resumes Hearing
AMZN,May-17-21,Bitcoin Wont Stop Dropping. Blame Elon Musk.
AMZN,May-17-21,"Inspirational Quotes: Drew Brees, Laura Ingalls Wilder, Dave Clark And Others"
AMZN,May-17-21,"The Zacks Analyst Blog Highlights: Spotify, Apple and Amazon"
AMZN,May-17-21,"The Zacks Analyst Blog Highlights: Amazon, Tesla, NextEra Energy, CME Group and Boston Scientific"
AMZN,May-17-21,"From Body Mechanics to Mindfulness, Amazon Launches Employee-Designed Health and Safety Program called WorkingWell Across U.S. Operations"
AMZN,May-17-21,3 Robinhood Stocks to Buy Right Now That Are Better Than Dogecoin
AMZN,May-17-21,"Lucira Health, Inc. (LHDX) Q1 2021 Earnings Call Transcript"
AMZN,May-17-21,Glaxo Study Has Positive Results; Singapore Curbs: Virus Update
AMZN,May-16-21,Amazon-backed Tado raises $46m in final fundraising round
GOOG,May-19-21,"Dow Jones Futures: Stock Market Rally Slashes Losses, Bitcoin Keeps Moving Late; Target, Facebook, Google In Buy Zones"
GOOG,May-19-21,Marriott Had Good News to Report
GOOG,May-19-21,Google is making search worse by making it easier
GOOG,May-19-21,Waymo Eyes Raising Up to $4 Billion as Leaders Exits Sow Doubts
GOOG,May-19-21,Michael Burry is Shorting Tesla and Buying These 10 Stocks Instead
GOOG,May-19-21,We're lacking a positive catalyst in the market: Sevens Report Research President
GOOG,May-19-21,EU Legislator Advocates User Privacy Rights Under EU Tech Rules: Reuters
GOOG,May-19-21,Exclusive - EU wants firm pledges from tech giants in fake news fight
GOOG,May-19-21,8 best home routers: Boost the speed of your internet connection
GOOG,May-19-21,Is Shopify Stock A Buy After Blowout Earnings Report?
GOOG,May-19-21,11 best smart speakers for virtual assistance at home and on the go
GOOG,May-19-21,Why women should go for top jobs and leadership roles
GOOG,May-19-21,EU lawmaker wants stronger privacy rights in proposed EU tech rules
GOOG,May-19-21,Alphabet Expands Its Shopify E-commerce Partnership
GOOG,May-19-21,Is Salesforce Stock A Buy? Digital Transformation Powerhouse Struggles Amid Slack Deal
GOOG,May-19-21,10 Biggest Companies and Hedge Funds Bullish on Ethereum
GOOG,May-19-21,Are the FAANG Stocks Still Good Buys Today?
GOOG,May-19-21,Movie theater experience has to reinvent itself: Jane Rosenthal
GOOG,May-19-21,"Google I/O: Wear OS, Android, Shopping, Holograms and More"
GOOG,May-19-21,"Down 40%, Is Now the Time to Buy Spotify Stock?"
GOOG,May-19-21,5 Stocks to Make the Most of Smart Home Market Growth
GOOG,May-19-21,Tech Market Crash: 3 Best Growth Stocks to Buy Now
GOOG,May-19-21,Google develops AI tool to help diagnose skin conditions
GOOG,May-19-21,Burger King aims to take chicken sandwich crown with new 'Ch'King'
GOOG,May-19-21,Jewish Google employees call for company to support Palestinians amid Israels bombing of Gaza
GOOG,May-18-21,Canada says reiterated to U.S. that it plans a digital services tax - minister
GOOG,May-18-21,Epic Tries to Show Apple Is Antitrust Violator Beyond App Store
GOOG,May-18-21,"Pinterest Promises More Gender, Racial Diverse Workforce: WSJ"
GOOG,May-18-21,"Google Debuts Shopping Graph, Machine Learning Tool to Make AI Easier"
GOOG,May-18-21,"Dow Jones Futures: Stock Market Rally Below Key Levels, Bitcoin Near Lows; More Bad Tesla News, These Old Winners Still Look Weak"
GOOG,May-18-21,"Google Puts Tools Rivaling Microsoft, Slack at Center of I/O"
GOOG,May-18-21,Google Launches News Showcase News In India
GOOG,May-18-21,Google is making big design and privacy changes to the world's most popular operating system
GOOG,May-18-21,Google Backtracks on Office Returns: Will Other Companies Follow?
GOOG,May-18-21,Amazon Extends Pause on Police Use of Facial Recognition Tech
GOOG,May-18-21,Google Docs to prompt users to write in gender-free language
GOOG,May-18-21,Google is teaming up with Samsung to take on the Apple Watch
GOOG,May-18-21,Shopify Merchants Will Be Showcased on Googles Shopping Site
GOOG,May-18-21,"Google announces a host of updates to Android, search and other features as part of I/O event"
GOOG,May-18-21,Google Adds Feature to Zap Recent Search History in Privacy Push
GOOG,May-18-21,"UPDATE 2-Slate of Google updates boost its smartwatch, work collaboration efforts"
GOOG,May-18-21,California DMV Probes Tesla Over Self-Driving Claims
GOOG,May-18-21,This Top Computer and Technology Stock is a #1 (Strong Buy): Why It Should Be on Your Radar
GOOG,May-18-21,"Down 30%, Is The Trade Desk a Screaming Buy?"
GOOG,May-18-21,Is Google Stock A Buy? Internet Search Giant Could Finally Be Best FANG Stock In 2021
GOOG,May-18-21,Google lays out new features to keep users clicking after lockdown
GOOG,May-18-21,Alphabets Google Migrates Ilunion to Cloud in Record Time
GOOG,May-18-21,Google ties up with 30 publishers to start news platform in COVID-ravaged India
GOOG,May-18-21,Google ties up with 30 publishers to start news platform in COVID-ravaged India
GOOG,May-17-21,Alibaba Leads $400 Million Investment in Vietnam Retail Firm
GOOG,May-17-21,Big Tech races to clean up act as cloud energy use grows
GOOG,May-17-21,U.S. labor leader calls for human drivers in automated vehicles
GOOG,May-17-21,UPDATE 2-U.S. labor leader calls for human drivers in automated vehicles
GOOG,May-17-21,These Are The Best Robinhood Stocks To Buy Or Watch Now
GOOG,May-17-21,Apple Begins App Store Defense in Epic Antitrust Fight
GOOG,May-17-21,Market volatility to continue through the summer: People's United Advisors CIO
GOOG,May-17-21,"UPDATE 1-Parler returns to Apple's App Store, names new CEO"
GOOG,May-17-21,"Parler returns to Apple's App Store, names new CEO"
GOOG,May-17-21,Dow Slips as Wall Street Continues to Back Value Over Growth
GOOG,May-17-21,Google I/O 2021 developer conference will feature Android 12 and maybe a Google watch
GOOG,May-17-21,Is Alphabet (GOOGL) Stock Outpacing Its Computer and Technology Peers This Year?
GOOG,May-17-21,Is Alphabet (GOOG) Stock Outpacing Its Computer and Technology Peers This Year?
GOOG,May-17-21,"Bragar Eagel & Squire is Investigating Certain Officers and Directors of XL Fleet, Zoom, Capital One, and Alphabet on Behalf of Long-Term Stockholders and Encourages Investors to Contact the Firm"
GOOG,May-17-21,"Dow Eases From Lows, But Remains Under Pressure as Tech Bleeds"
GOOG,May-17-21,Microsoft is extending its Teams app to regular consumers
GOOG,May-17-21,10 Best AI Stocks under $50
GOOG,May-17-21,"France embraces Google, Microsoft in quest to safeguard sensitive data"
GOOG,May-17-21,"Dow Jones Futures Fall In Still-Tricky Market, But ASML, Google Flash Buys; Bitcoin Dives On Latest Musk Tweets"
GOOG,May-17-21,Gojek to Merge With Tokopedia to Create Indonesia Tech Giant
GOOG,May-16-21,Critics raise alarm over Big Techs most powerful tools
GOOG,May-16-21,Revealed: The areas in the UK with the highest financial literacy
GOOG,May-16-21,Ignore Dogecoin: These Stocks Will Make You Rich
GOOG,May-15-21,UK online harms bill misses frauds gateway
GOOG,May-15-21,Should You HODL Bitcoin?
GOOG,May-15-21,One Of The Best Mutual Fund's Bets On Economic Reopening
GOOG,May-15-21,Elon Musk's Best Investments
GOOG,May-15-21,Tech Stocks Roundup: Jim Cramer Says to Hold Onto FAANG Stocks
GOOG,May-14-21,Fired Engineer Says Apple Was Previously Aware of His Writing
GOOG,May-14-21,"Two Tech Firms, Together Worth $1.8 Trillion, Join The Long-Term Leaders"
GOOG,May-14-21,Dow Jones Gains As Rally Continues; Disney Stock Dives; Google Stock Offers Buy Point
GOOG,May-14-21,California District Judge Dismisses Google Antitrust Lawsuit Brought By Advertiser Group: Reuters
GOOG,May-14-21,US Senators On The Verge Of A $52B Chip Funding Deal Announcement: Reuters
GOOG,May-14-21,Bitcoins reflecting a new dimension of thinking about cryptocurrency: Rayliant Global Advisors CIO
GOOG,May-14-21,Alphabet (GOOG)s Notable Q1 Performance Took a Spot in Polen Capitals Top Contributors List
GOOG,May-14-21,Tech Fights Claim That Foreign-Worker Spouses Help Take Jobs
GOOG,May-14-21,Bird CEO on micromobility industry: 'the future is electrified transportation'
GOOG,May-14-21,Google Rebounds Bullishly
GOOG,May-14-21,S&P 500 Racks Up Gains as Tech Turnaround Continues After Recent Rout
GOOG,May-14-21,Alphabet (GOOGL) Boosts Google Pay Reach With New Feature
GOOG,May-14-21,Zoom Video Rebounds From Recent Drop; Mizuho Bullish
GOOG,May-14-21,Here Are The Leaders In Cloud Computing Spending  Maybe
GOOG,May-14-21,Google leads U.S. business push to preserve work permits for H-1B spouses
GOOG,May-14-21,Apple and Microsofts Rivalry Had Cooled. Now Its Back and Getting Testier
GOOG,May-13-21,UPDATE 1-U.S. judge dismisses advertisers' antitrust claims against Google
GOOG,May-13-21,U.S. judge dismisses advertisers' antitrust claims against Google
GOOG,May-13-21,Biden's $2.5 Trillion Infrastructure Plan Could Send These EV Stocks Soaring
GOOG,May-13-21,Google Stock Rises As Cloud Computing Unit Wins Starlink Contract
GOOG,May-13-21,Dow Jones Spikes As Bitcoin Dives On Elon Musk Tweet; Tesla Loses Key Level; Apple Bites Back
GOOG,May-13-21,Tesla Is Getting Closer to an Autonomous Vehicle. Just Ask Elon Musk.
GOOG,May-13-21,Recent privacy changes in the digital ad industry will mainly benefit people in rich countries
FB,May-19-21,ByteDance Founder Steps Down as CEO Ahead of Mega IPO
FB,May-19-21,"Singapore tells Facebook, Twitter to carry correction notice on virus strain"
FB,May-19-21,"Dow Jones Futures: Stock Market Rally Slashes Losses, Bitcoin Keeps Moving Late; Target, Facebook, Google In Buy Zones"
FB,May-19-21,"Singapore tells Facebook, Twitter to carry correction notice on virus strain"
FB,May-19-21,Apple will face a critical test when CEO Tim Cook testifies at the Epic trial
FB,May-19-21,Michael Burry is Shorting Tesla and Buying These 10 Stocks Instead
FB,May-19-21,"FB Stock Still A Buy? Facebook Rally Faces Test Amid Opt-Outs, Big Tech Slump"
FB,May-19-21,Facebook Eyes Pay-Per-View Model To Monetize Live Online Sports: CNBC
FB,May-19-21,EU Legislator Advocates User Privacy Rights Under EU Tech Rules: Reuters
FB,May-19-21,UPDATE 1-Facebook deploys special team as Israel-Gaza conflict spreads across social media
FB,May-19-21,Facebook deploys special team as Israel-Gaza conflict spreads across social media
FB,May-19-21,Facebook running special center to respond to content on Israeli-Gaza conflict
FB,May-19-21,Facebook blames glitch after huge drop in child abuse image takedowns
FB,May-19-21,Facebook Removed 18 Million Misleading Posts on Covid-19
FB,May-19-21,Is Shopify Stock A Buy After Blowout Earnings Report?
FB,May-19-21,Is Facebook (FB) Stock Outpacing Its Computer and Technology Peers This Year?
FB,May-19-21,Why women should go for top jobs and leadership roles
FB,May-19-21,Fox's (FOXA) News Digital Surpasses Peers in April Viewership
FB,May-19-21,Are the FAANG Stocks Still Good Buys Today?
FB,May-19-21,Movie theater experience has to reinvent itself: Jane Rosenthal
FB,May-18-21,Facebook Composite Rating Bumps Up To 96
FB,May-18-21,"Facebook Launches Live Shopping Fridays for Beauty, Fashion"
FB,May-18-21,These Are The 5 Best Stocks To Buy And Watch Now
FB,May-18-21,UPDATE 1-U.S. lawmakers urge Facebook to drop plans for Instagram for kids
FB,May-18-21,U.S. lawmakers urge Facebook to drop plans for Instagram for kids
FB,May-18-21,"If I Could Buy Only 1 Stock, This Would Be It"
FB,May-18-21,Facebook to Launch Diem Cryptocurrency Amid Rising Digitalization
FB,May-17-21,Is GBTC Stock A Good Buy As Bitcoin Plunges From Highs After Elon Musk Tweets?
FB,May-17-21,Facebooks Head of Oculus and VR Partnerships Is Leaving the Company
FB,May-17-21,Market volatility to continue through the summer: People's United Advisors CIO
FB,May-17-21,"Facebook, German publisher Axel Springer strike global cooperation deal"
FB,May-17-21,"Facebook, German publisher Axel Springer strike global cooperation deal"
FB,May-17-21,UK's fifth largest accountant tells staff to work where they want
FB,May-17-21,10 Best AI Stocks under $50
FB,May-17-21,10 Best Dividend Stocks to Buy Now According to Billionaire Cliff Asness
FB,May-17-21,"The Best Stocks to Invest $10,000 In Right Now"
FB,May-16-21,Facebooks Oversight Board: an imperfect solution to a complex problem
FB,May-16-21,Social media has no incentive to fix what ails it
FB,May-16-21,Revealed: The areas in the UK with the highest financial literacy
FB,May-16-21,4 Surefire Value Stocks to Buy for a Biden Bull Market
FB,May-15-21,Should You HODL Bitcoin?
FB,May-15-21,Elon Musk's Best Investments
FB,May-15-21,Tech Stocks Roundup: Jim Cramer Says to Hold Onto FAANG Stocks
FB,May-14-21,Facebook wrongly removes coronavirus adverts bought by UK Government
FB,May-14-21,European Data Watch Dog Prevails Over Facebook In Initial EU-US Data Transfer Ruling
FB,May-14-21,Bitcoins reflecting a new dimension of thinking about cryptocurrency: Rayliant Global Advisors CIO
FB,May-14-21,"Gundlach: Bitcoin, crypto 'poster child' of speculative, 'funny money' market"
FB,May-14-21,RPT-UPDATE 3-Facebook faces prospect of 'devastating' data transfer ban after Irish ruling
FB,May-14-21,Facebook claims Hamburg order to keep WhatsApp data separate has no legitimate basis
FB,May-14-21,Facebook faces suspension of data transfers in Europe
FB,May-14-21,Facebook Faces Suspension of Data Transfer in Europe
FB,May-14-21,Court allows Irish regulator to proceed with inquiry into Facebook data flows
FB,May-14-21,Court allows Irish regulator to proceed with inquiry into Facebook data flows
FB,May-14-21,UPDATE 3-Facebook faces prospect of 'devastating' data transfer ban after Irish ruling
FB,May-14-21,WhatsApps new terms reminders to get more persistent - and Facebook will kill features if you dont agree
FB,May-14-21,Facebook faces prospect of 'devastating' data transfer ban after Irish ruling
FB,May-14-21,Facebook data flow ruling from Irish court due Friday
FB,May-14-21,Singapore Moves Back Toward Lockdown as Virus Cases Rise
FB,May-13-21,Daddy Issues Duo Warms Hearts on TikTok But Did the China-Owned Platform Give Them the Cold Shoulder?
FB,May-13-21,Teens and social media: 'Unfollow some accounts that don't make you feel good'
FB,May-13-21,Facebook (FB) Upgraded to Strong Buy: Here's Why
FB,May-13-21,This Crypto Stock Was Thursday's Big Winner Despite Bitcoin's Plunge
FB,May-13-21,How to Find Strong Buy Computer and Technology Stocks Using the Zacks Rank
FB,May-13-21,Why Shares of Silvergate Capital Are Jumping Today
FB,May-13-21,"The Zacks Analyst Blog Highlights: Google, Facebook and Sony"
FB,May-13-21,"Twitter Picks Up Acquisition Pace, Driven by New Product Push"
FB,May-13-21,Silvergate Rises on Deal to Issue Facebook-Backed Diem Coin
FB,May-12-21,SoftBank Tumbles After Record Profit Fails to Impress
FB,May-12-21,Facebook-backed Diem digital currency project moving to U.S.
FB,May-12-21,Apple Says Ads Engineer Leaves Company After Comments Draw Fire
FB,May-12-21,"Amid Nasdaq Rout, Big Facebook Options Play Catches Trader Eyes"
FB,May-12-21,Silvergate Capital to Become Exclusive Issuer of Facebook's Diem Stablecoin
FB,May-12-21,Why this is not the time to sell tech stocks
FB,May-12-21,Facebook-Backed Digital Currency Project Revamps to Address U.S. Regulators Concerns
FB,May-12-21,UPDATE 1-Facebook-backed crypto project Diem to launch U.S. stablecoin in major shift
FB,May-12-21,Facebooks Crypto Project Reboots With Smaller Ambitions
FB,May-12-21,Overnight Crypto Sensation Sets Out to Undo Internets Failings
FB,May-12-21,Facebook-backed crypto project Diem to launch U.S. stablecoin in major shift
FB,May-12-21,Wall Street Pondering Ugly Outcomes for Sky-High Tech Shares
FB,May-12-21,Facebook-backed crypto project Diem to launch U.S. stablecoin in major shift
FB,May-12-21,Judge In Federal Antitrust Case Against Facebook Delays Discovery Process: Reuters
FB,May-12-21,Facebook Calendar Spread Offers Attractive Risk-Reward Ratio In Options Trading
FB,May-12-21,Facebook Calendar Spread Offers Attractive Risk-Reward Ratio In Options Trading
FB,May-12-21,WFH opens up companies to more cyber threats: Microsoft
FB,May-12-21,Ukrainian MP denies involvement in violations of Facebook rules
FB,May-12-21,10 Best Pharmaceutical Stocks to Buy According to Billionaire Kerr Neilson
FB,May-12-21,Option Trade Review: A Neutral To Bullish Trade In Facebook
FB,May-12-21,Dow Jones Futures Fall As Market Rally Awaits Inflation Data; Tesla Sales Crash In China Confirmed
FB,May-12-21,"Virtual Reality Stocks: Skip Facebook, Buy This Stock Instead"
FB,May-12-21,Facebook Facing Fine Over Unconsented Israeli Acquisitions?
FB,May-12-21,SoftBanks Masayoshi Son Isnt So Sure About Bitcoin
FB,May-12-21,Snapchat wants a piece of the social marketplace
FB,May-11-21,TikTok Begins Testing In-App Shopping to Challenge Facebook
FB,May-11-21,How China is shaping the future of shopping
FB,May-11-21,U.K. Adds Anti-Censorship Clause to Online Safety Bill
FB,May-11-21,The Sons of Sam Director on the boom in popularity of true crime documentaries
FB,May-11-21,"Coinbase Could Have a Facebook-Like Rebound, Bull Argues"
FB,May-11-21,"Amazon, Most-Punished Tech Stocks Stage Rebound After Slump"
FB,May-11-21,Tech Stocks Are Getting Hammered. Heres the Logic Behind the Rout.
FB,May-11-21,"Earnings Roundup: Facebook, Amazon, and Shopify"
